<?xml version="1.0" encoding="Big5"?>
<!ELEMENT library (book+)>
<!ELEMENT book (title, author, price, year)>
<!ATTLIST book	code CDATA #REQUIRED>
<!ELEMENT title (#PCDATA)>
<!ELEMENT author (#PCDATA)>
<!ELEMENT price (#PCDATA)>
<!ELEMENT year (#PCDATA)>